{
  "$schema": "https://json-schema.org/draft/2020-12/schema",
  "$id": "urn:magic-glass-box:schema:inference-invocation-response:v2",
  "title": "Magic Glass Box Inference Invocation Response v2",
  "type": "object",
  "additionalProperties": false,
  "required": [
    "budget",
    "connector_id",
    "connector_protocol_version",
    "credential_scope_sha256",
    "deadline",
    "deployment_sha256",
    "error_code",
    "grant_id",
    "invocation_id",
    "model",
    "outcome",
    "policy_sha256",
    "protocol",
    "provider",
    "provider_status",
    "request_bytes",
    "request_limit_bytes",
    "response",
    "response_bytes",
    "response_limit_bytes",
    "route",
    "schema_version",
    "usage"
  ],
  "properties": {
    "schema_version": { "const": 1 },
    "connector_protocol_version": { "const": 2 },
    "invocation_id": { "type": "string", "pattern": "^pinv_[0-9a-f]{32}$" },
    "connector_id": { "type": "string", "pattern": "^ifc_[0-9a-f]{32}$" },
    "deployment_sha256": { "$ref": "#/$defs/sha256" },
    "route": { "$ref": "#/$defs/name" },
    "grant_id": { "type": "string", "pattern": "^pgr_[0-9a-f]{32}$" },
    "policy_sha256": { "$ref": "#/$defs/sha256" },
    "credential_scope_sha256": { "$ref": "#/$defs/sha256" },
    "provider": { "$ref": "#/$defs/name" },
    "protocol": { "$ref": "#/$defs/name" },
    "model": { "$ref": "#/$defs/model" },
    "deadline": { "type": "string", "format": "date-time", "maxLength": 64 },
    "request_limit_bytes": {
      "type": "integer",
      "minimum": 1,
      "maximum": 2097152
    },
    "response_limit_bytes": {
      "type": "integer",
      "minimum": 1,
      "maximum": 4194304
    },
    "budget": { "$ref": "#/$defs/budget" },
    "outcome": { "enum": ["succeeded", "failed", "ambiguous"] },
    "provider_status": {
      "type": ["integer", "null"],
      "minimum": 100,
      "maximum": 599
    },
    "request_bytes": { "type": "integer", "minimum": 0, "maximum": 2097152 },
    "response_bytes": { "type": "integer", "minimum": 0, "maximum": 4194304 },
    "retry_after_seconds": {
      "type": "integer",
      "minimum": 1,
      "maximum": 2592000
    },
    "error_code": {
      "type": ["string", "null"],
      "pattern": "^[a-z][a-z0-9_-]{0,63}$"
    },
    "response": { "type": ["object", "null"] },
    "usage": {
      "oneOf": [
        { "$ref": "#/$defs/usage" },
        { "type": "null" }
      ]
    }
  },
  "allOf": [
    {
      "if": {
        "properties": { "outcome": { "const": "succeeded" } },
        "required": ["outcome"]
      },
      "then": {
        "properties": {
          "provider_status": { "type": "integer", "minimum": 200, "maximum": 299 },
          "error_code": { "type": "null" },
          "response": { "type": "object" },
          "usage": { "$ref": "#/$defs/usage" }
        }
      },
      "else": {
        "properties": {
          "error_code": { "$ref": "#/$defs/name" },
          "response": { "type": "null" }
        }
      }
    },
    {
      "if": { "required": ["retry_after_seconds"] },
      "then": { "properties": { "outcome": { "const": "failed" } } }
    }
  ],
  "$defs": {
    "budget": {
      "type": "object",
      "additionalProperties": false,
      "required": [
        "cached_input_microusd_per_million_tokens",
        "currency",
        "input_microusd_per_million_tokens",
        "max_output_tokens",
        "output_microusd_per_million_tokens",
        "policy_sha256",
        "reservation_microusd"
      ],
      "properties": {
        "policy_sha256": { "$ref": "#/$defs/sha256" },
        "currency": { "const": "USD" },
        "reservation_microusd": { "$ref": "#/$defs/positiveMicrousd" },
        "max_output_tokens": {
          "type": "integer",
          "minimum": 1,
          "maximum": 1000000
        },
        "input_microusd_per_million_tokens": { "$ref": "#/$defs/microusd" },
        "cached_input_microusd_per_million_tokens": {
          "$ref": "#/$defs/microusd"
        },
        "output_microusd_per_million_tokens": { "$ref": "#/$defs/microusd" }
      }
    },
    "usage": {
      "type": "object",
      "additionalProperties": false,
      "required": [
        "cached_input_tokens",
        "input_tokens",
        "output_tokens",
        "reasoning_output_tokens"
      ],
      "properties": {
        "input_tokens": { "$ref": "#/$defs/tokenCount" },
        "cached_input_tokens": { "$ref": "#/$defs/tokenCount" },
        "output_tokens": { "$ref": "#/$defs/tokenCount" },
        "reasoning_output_tokens": { "$ref": "#/$defs/tokenCount" }
      }
    },
    "tokenCount": {
      "type": "integer",
      "minimum": 0,
      "maximum": 1000000000000
    },
    "microusd": {
      "type": "integer",
      "minimum": 0,
      "maximum": 1000000000000
    },
    "positiveMicrousd": {
      "type": "integer",
      "minimum": 1,
      "maximum": 1000000000000
    },
    "name": {
      "type": "string",
      "pattern": "^[a-z][a-z0-9_-]{0,63}$"
    },
    "model": {
      "type": "string",
      "minLength": 1,
      "maxLength": 256,
      "pattern": ".*\\S.*"
    },
    "sha256": {
      "type": "string",
      "pattern": "^[0-9a-f]{64}$"
    }
  }
}
