{
  "budget": {
    "cached_input_microusd_per_million_tokens": 125000,
    "currency": "USD",
    "input_microusd_per_million_tokens": 1250000,
    "max_output_tokens": 1000,
    "output_microusd_per_million_tokens": 10000000,
    "policy_sha256": "82fd17dbdb95e904705c48cb76f245238bee1cd9114c5c5aff1c544150caae3a",
    "reservation_microusd": 100000
  },
  "connector_id": "ifc_22222222222222222222222222222222",
  "connector_protocol_version": 2,
  "credential_scope_sha256": "bbbbbbbbbbbbbbbbbbbbbbbbbbbbbbbbbbbbbbbbbbbbbbbbbbbbbbbbbbbbbbbb",
  "deadline": "2026-10-17T20:00:00.000000+00:00",
  "deployment_sha256": "aaaaaaaaaaaaaaaaaaaaaaaaaaaaaaaaaaaaaaaaaaaaaaaaaaaaaaaaaaaaaaaa",
  "error_code": null,
  "grant_id": "pgr_33333333333333333333333333333333",
  "invocation_id": "pinv_11111111111111111111111111111111",
  "model": "gpt-test",
  "outcome": "succeeded",
  "policy_sha256": "cccccccccccccccccccccccccccccccccccccccccccccccccccccccccccccccc",
  "protocol": "openai-responses",
  "provider": "openai",
  "provider_status": 200,
  "request_bytes": 97,
  "request_limit_bytes": 16384,
  "response": {
    "output_text": "done"
  },
  "response_bytes": 32,
  "response_limit_bytes": 32768,
  "route": "chatgpt-main",
  "schema_version": 1,
  "usage": {
    "cached_input_tokens": 250,
    "input_tokens": 1000,
    "output_tokens": 100,
    "reasoning_output_tokens": 25
  }
}
